{
  "meta": {
    "course_key": "kurssi_7",
    "lesson_index": 11,
    "lesson_type": "writing",
    "level": "M",
    "title": "Argumentoiva teksti (180–220 sanaa)",
    "description": "Kirjoita argumentoiva teksti käyttäen subjunktiivia ja pluskvamperfektiä. YO-tason kirjoitustehtävä M-tasolla.",
    "yo_relevance": "Tämä on YO-koetta suoraan simuloiva tehtävä. M-tason kirjoituksessa arvioidaan subjunktiivin hallintaa, rekisterin johdonmukaisuutta ja argumentaation selkeyttä. 180–220 sanan pituus vastaa YO-koeen kirjoitustehtävää.",
    "estimated_minutes_median": 20
  },
  "teaching": {
    "intro_md": "# Argumentoiva teksti, M-taso\n\nYO-kokeessa kirjoitustehtävä arvioi:\n1. **Viestintä**, välittyykö ajatus selkeästi?\n2. **Rakenne**, onko teksti johdonmukainen?\n3. **Sanasto**, onko se aiheelle sopivaa ja monipuolista?\n4. **Kielioppi**, onko rakenteet oikein?\n\n## M-tason odotukset\n\n- Subjunktiivi vähintään 2–3 kertaa luontevasti\n- Pluskvamperfekti ainakin kerran (jos aihe sopii)\n- Argumentointilauseita: *No creo que..., Es importante que..., Para que...*\n- Selkeä rakenne: johdanto → argumentit → lopetus\n- Ei mekaanisia virheitä (sukupäätteet, konjugaatiot)\n\n## Hyödylliset rakenteet\n\n| Tarkoitus | Rakenne |\n|---|---|\n| Väittämä | *Es cierto que... / No es cierto que...* |\n| Tärkeys | *Es importante que... / Es fundamental que...* |\n| Tarkoitus | *Para que... / A fin de que...* |\n| Epäilys | *Dudo que... / No creo que...* |\n| Historiallinen viittaus | *Antes de que... / Cuando ya había...* |\n\n## Rakenne\n\n**Johdanto (2–3 lausetta):** esittele aihe\n\n**Pääosa (3–5 lausetta):** argumentit, esimerkit\n\n**Lopetus (1–2 lausetta):** johtopäätös tai omaiskohtainen näkökulma\n\n## Muista\n\n- Käytä sidossanoja: *Además, Sin embargo, Por eso, Por lo tanto, En primer lugar, En conclusión*\n- Älä aloita joka lausetta samalla rakenteella\n- Tarkista sukupäätteet ja verbien konjugaatiot",
    "key_points": [
      "YO-kirjoitustehtävässä 180–220 sanaa on ohjaava mitta, ei pakollinen",
      "Subjunktiivi luontevasti: älä pakota rakennetta lauseeseen jossa se ei sovi",
      "Rakenne: johdanto (2–3 laus.) → 2–3 argumenttia → lopetus (1–2 laus.)",
      "Sidossanat tekevät tekstistä johdonmukaisen: además, sin embargo, por eso, en primer lugar",
      "Rekisteri: kirjoitustehtävässä käytetään formaalia rekisteriä, ei slangaa"
    ]
  },
  "phases": [
    {
      "phase_id": "p1-writing",
      "phase_type": "writing_long",
      "title": "Argumentoiva kirjoitustehtävä, M-taso",
      "instruction": "Kirjoita argumentoiva teksti espanjaksi annetusta aiheesta. 180–220 sanaa.",
      "mastery_threshold": { "I": 0.55, "A": 0.60, "B": 0.65, "C": 0.70, "M": 0.80, "E": 0.85, "L": 0.95 },
      "skip_for_targets": [],
      "items": [
        {
          "item_type": "writing",
          "prompt": "¿Debería el gobierno financiar el arte y la cultura?\n\nKirjoita argumentoiva teksti (180–220 sanaa) tästä aiheesta. Vaatimukset:\n- Esitä selkeä kanta (puolesta tai vastaan)\n- Käytä subjunktiivia vähintään 2 kertaa\n- Käytä vähintään yhtä pluskvamperfektiä tai historiallista viittausta\n- Käytä sidossanoja (además, sin embargo, por eso)\n- Käytä K7:n sanastoa: la herencia cultural, el patrimonio, apreciar, influir en, para que...\n\nArviointi kohdistuu: viestintään, rakenteeseen, sanastoon ja kielioppiin.",
          "min_words": 160,
          "max_words": 240,
          "rubric_focus": ["communication", "structure", "vocab", "overall"]
        },
        {
          "item_type": "writing",
          "prompt": "¿Tienen las redes sociales un impacto positivo o negativo en la cultura?\n\nKirjoita argumentoiva teksti (180–220 sanaa). Vaatimukset:\n- Esitä selkeä kanta ja perustele se\n- Käytä subjunktiivia (no creo que, es importante que, para que)\n- Mainitse historiallinen perspektiivi (pluskvamperfekti tai vertailu menneeseen)\n- Käytä K7L8:n mediasanastoa: difundir, la desinformación, la libertad de prensa, informar\n- Rakenne: johdanto → 2–3 argumenttia → lopetus",
          "min_words": 160,
          "max_words": 240,
          "rubric_focus": ["communication", "structure", "vocab", "overall"]
        },
        {
          "item_type": "writing",
          "prompt": "¿Qué podemos aprender de la historia política de España?\n\nKirjoita argumentoiva teksti (180–220 sanaa). Vaatimukset:\n- Käytä konkreettisia historiallisia esimerkkejä (Francon diktatuuri, Transición, Lorca tms.)\n- Käytä pluskvamperfektiä kuvaamaan tapahtuneita ennen toista menneisyyttä\n- Käytä subjunktiivia argumentoinnissa (es importante que, no creo que, para que)\n- Käytä K7L4:n historia- ja politiikkasanastoa\n- Rakenne: johdanto → historiallinen esimerkki → opetus → lopetus",
          "min_words": 165,
          "max_words": 250,
          "rubric_focus": ["communication", "structure", "vocab", "overall"]
        }
      ]
    }
  ],
  "vocab": [
    { "es": "en primer lugar", "fi": "ensinnäkin, ensiksi", "example_es": "En primer lugar, es importante que el arte sea accesible para todos.", "example_fi": "Ensinnäkin, on tärkeää että taide on kaikkien saatavilla.", "gender": null },
    { "es": "además", "fi": "lisäksi, myös", "example_es": "Además, la cultura contribuye al bienestar social.", "example_fi": "Lisäksi kulttuuri edistää sosiaalista hyvinvointia.", "gender": null },
    { "es": "sin embargo", "fi": "kuitenkin, siitä huolimatta", "example_es": "Sin embargo, no todos los ciudadanos tienen acceso a ella.", "example_fi": "Kuitenkin kaikilla kansalaisilla ei ole siihen pääsyä.", "gender": null },
    { "es": "por eso", "fi": "siksi, tämän vuoksi", "example_es": "Por eso, es fundamental invertir en cultura.", "example_fi": "Siksi kulttuuriin on välttämätöntä investoida.", "gender": null },
    { "es": "por lo tanto", "fi": "siksi, näin ollen", "example_es": "Por lo tanto, el gobierno debe apoyar el arte.", "example_fi": "Näin ollen hallituksen täytyy tukea taidetta.", "gender": null },
    { "es": "en conclusión", "fi": "lopuksi, yhteenvetona", "example_es": "En conclusión, la cultura es esencial para la sociedad.", "example_fi": "Lopuksi, kulttuuri on välttämätöntä yhteiskunnalle.", "gender": null },
    { "es": "a mi modo de ver", "fi": "minun näkemykseni mukaan", "example_es": "A mi modo de ver, el arte refleja la realidad.", "example_fi": "Minun näkemykseni mukaan taide heijastaa todellisuutta.", "gender": null },
    { "es": "desde mi punto de vista", "fi": "näkökulmastani, mielestäni", "example_es": "Desde mi punto de vista, la censura es inaceptable.", "example_fi": "Näkökulmastani sensuuri on hyväksymätöntä.", "gender": null },
    { "es": "hay que", "fi": "täytyy, on pakko (yleinen)", "example_es": "Hay que proteger la libertad artística.", "example_fi": "Taiteellinen vapaus täytyy suojella.", "gender": null },
    { "es": "es imprescindible", "fi": "on välttämätöntä", "example_es": "Es imprescindible que los jóvenes conozcan la historia.", "example_fi": "On välttämätöntä että nuoret tuntevat historian.", "gender": null },
    { "es": "contribuir a", "fi": "edistää, myötävaikuttaa", "example_es": "La cultura contribuye al bienestar de los ciudadanos.", "example_fi": "Kulttuuri edistää kansalaisten hyvinvointia.", "gender": null },
    { "es": "cabe destacar", "fi": "on syytä korostaa", "example_es": "Cabe destacar que el flamenco fue declarado patrimonio.", "example_fi": "On syytä korostaa, että flamenco julistettiin perinnöksi.", "gender": null }
  ],
  "side_panel": {
    "tabs": [
      {
        "id": "examples",
        "title": "Mallirakenteet",
        "content_md": "## Johdanto\n\n```\nEl tema de la cultura en la sociedad contemporánea\nes complejo y apasionante.\n\nEn los últimos años, el debate sobre...\nha cobrado especial importancia.\n```\n\n## Argumentit\n\n```\nEn primer lugar, es importante que...\n\nAdemás, no creo que... sea posible sin...\n\nSin embargo, dudo que... pueda...\n\nPor otro lado, es cierto que...\n```\n\n## Historiallinen viittaus\n\n```\nA lo largo de la historia, el arte...\n\nCuando la dictadura terminó, ya habían...\n\nAntes de que la democracia llegara, muchos...\n```\n\n## Lopetus\n\n```\nEn conclusión, es fundamental que...\n\nPor lo tanto, creo que es necesario que...\n\nA mi modo de ver, la solución es que...\n```"
      },
      {
        "id": "tips",
        "title": "YO-vinkki",
        "content_md": "## Kirjoitustehtävä YO-kokeessa\n\n**Arviointi (M-taso):**\n- Viestintä: välittyykö sanoma?\n- Rakenne: johdanto-pääosa-lopetus?\n- Sanasto: aiheelle sopivaa, vaihtelevaa?\n- Kielioppi: rakenteita käytetty oikein?\n\n**Subjunktiivi M-tasolla:**\n\n✓ *Es importante que el gobierno **invierta** en cultura.*\n\n✓ *Para que los jóvenes **conozcan** la historia.*\n\n✓ *No creo que la censura **sea** aceptable.*\n\n**Pluskvamperfekti:**\n\n✓ *Cuando la democracia llegó, muchos artistas\nja habían muerto en el exilio.*\n\n**Rakenne:**\n1. Johdanto (2–3 lausetta)\n2. Argumentti 1 + esimerkki\n3. Argumentti 2 + vastaväite/vertailu\n4. Lopetus (kanta + toive)\n\n**Muista:**\n- Lue ohje huolellisesti\n- Vastaa kysyttyyn aiheeseen\n- Tarkista sukupäätteet"
      }
    ]
  }
}
