{
  "meta": {
    "course_key": "kurssi_4",
    "lesson_index": 10,
    "lesson_type": "writing",
    "level": "B",
    "title": "Kirjoitustehtävä: Décrivez votre enfance",
    "description": "Kirjoitustehtävä: kuvaile lapsuuttasi ranskaksi. Imparfait pakollinen. Rubric: viestinnällisyys, rakenteet (imparfait/passé composé), sanasto, kokonaisuus. YTL-merkkimäärä: lyhyt 160–240, pitkä 300–450 merkkiä.",
    "yo_relevance": "Tämä tehtävätyyppi (kirjoita lapsuudesta) on yksi YO:n yleisimmistä kirjoitelman aiheista. Tässä oppitunnissa harjoitellaan täyttä YO-kirjoitelmaa rubricin kaikilla neljällä dimensiolla.",
    "estimated_minutes_median": 20
  },
  "teaching": {
    "intro_md": "# Kirjoitustehtävä, Décrivez votre enfance\n\nTässä oppitunnissa kirjoitat lapsuudestasi ranskaksi, täydellä YO-rubricilla arvosteltuna.\n\n## YTL-merkkimäärä\n\n- **Lyhyt tehtävä (rédaction courte):** 160–240 merkkiä ilman välilyöntejä\n- **Pitkä tehtävä (rédaction longue):** 300–450 merkkiä ilman välilyöntejä\n\nÄlä laske sanoja, laske merkkejä!\n\n## Rakenne, hyvä lapsuuskirjoitelma\n\n**1. Taustan esittely (imparfait)**\nKuvaa missä kasvoit, millainen ympäristö oli.\n\n**2. Toistuva arki (imparfait)**\nKerro mitä teitte yleensä.\n\n**3. Yksittäinen muisto (passé composé)**\nKerro yhdestä erityisestä tapahtumasta.\n\n**4. Reflektio**\nMitä nämä muistot merkitsevät?\n\n## Avainfraasit\n\n- *Quand j'étais petit(e), ...*, imparfait!\n- *Il y avait ...*, kuvaa ympäristöä\n- *Tous les étés / chaque soir ...*, toistuva toiminta\n- *Un jour, ...*, yksittäinen muisto (passé composé)\n- *Je me souviens encore de ...*, reflektio\n- *C'était une époque heureuse.*, yhteenveto\n\n## YTL:n neljä arviointidimensiota\n\n1. **Viestinnällisyys:** Välittyykö viesti? Onko kaikki tehtävänannon kohdat käsitelty?\n2. **Kielen rakenteet:** Imparfait ja passé composé oikein? Accord?\n3. **Sanasto:** Monipuolinen? Aihekohtainen?\n4. **Kokonaisuus:** Sidesanat? Looginen rakenne?",
    "key_points": [
      "Merkkimäärä lasketaan ILMAN välilyöntejä ja rivinvaihtoja.",
      "Imparfait kuvailevan taustaan, passé composé yksittäiseen tapahtumaan.",
      "Käytä sidesanoja: et, mais, donc, alors, parce que, cependant.",
      "Aloita tervehdyksellä jos tehtävätyyppi on kirje tai sähköposti.",
      "YO-kirjoitelmassa EI tarvitse kertoa todellisuutta, voit keksiä hahmoja ja paikkoja."
    ]
  },
  "phases": [
    {
      "phase_id": "p1-writing-lyhyt",
      "phase_type": "writing_long",
      "title": "Kirjoitustehtävä: lyhyt kirjoitelma",
      "instruction": "Kirjoita lyhyt kirjoitelma ranskaksi. Tavoite: 160–240 merkkiä (ilman välilyöntejä).",
      "mastery_threshold": { "I": 0.3, "A": 0.38, "B": 0.52, "C": 0.63, "M": 0.75, "E": 0.85, "L": 0.95 },
      "skip_for_targets": [],
      "items": [
        {
          "item_type": "writing",
          "prompt": "Ranskalainen kynäystäväsi pyytää sinua kertomaan lapsuudestasi. Kirjoita hänelle lyhyt viesti (160–240 merkkiä ilman välilyöntejä) ranskaksi. Käytä imparfaitia. Kerro: missä kasvoit, mitä teit, millainen lapsuutesi oli.",
          "min_words": 25,
          "max_words": 60,
          "rubric_focus": ["communication", "structure", "vocab", "overall"]
        }
      ]
    },
    {
      "phase_id": "p2-writing-pitka",
      "phase_type": "writing_long",
      "title": "Kirjoitustehtävä: pitkä kirjoitelma",
      "instruction": "Kirjoita pitkä kirjoitelma ranskaksi. Tavoite: 300–450 merkkiä (ilman välilyöntejä). Pakollinen: imparfait JA passé composé.",
      "mastery_threshold": { "I": 0.3, "A": 0.38, "B": 0.52, "C": 0.63, "M": 0.75, "E": 0.85, "L": 0.95 },
      "skip_for_targets": ["I", "A"],
      "items": [
        {
          "item_type": "writing",
          "prompt": "YO-tyypillinen tehtävä: 'Décrivez votre enfance. Où avez-vous grandi? Quels sont vos meilleurs souvenirs? Y a-t-il quelque chose que vous regrettez?' Kirjoita 300–450 merkkiä (ilman välilyöntejä). Pakollinen rakenne: imparfait (kuvaileva tausta) + passé composé (yksittäinen muisto) + reflektio.",
          "min_words": 50,
          "max_words": 100,
          "rubric_focus": ["communication", "structure", "vocab", "overall"]
        }
      ]
    }
  ],
  "vocab": [
    { "es": "quand j'étais petit(e)", "fi": "kun olin pieni", "example_es": "Quand j'étais petit, je jouais dehors.", "example_fi": "Kun olin pieni, leikin ulkona.", "gender": null },
    { "es": "il y avait", "fi": "oli olemassa", "example_es": "Il y avait une rivière près de chez nous.", "example_fi": "Meillä lähellä oli joki.", "gender": null },
    { "es": "tous les étés", "fi": "joka kesä", "example_es": "Tous les étés, on allait à la mer.", "example_fi": "Joka kesä menimme merelle.", "gender": null },
    { "es": "je me souviens de", "fi": "muistan", "example_es": "Je me souviens encore de cette journée.", "example_fi": "Muistan vieläkin tuon päivän.", "gender": null },
    { "es": "c'était une époque heureuse", "fi": "se oli onnellinen aika", "example_es": "C'était une époque heureuse.", "example_fi": "Se oli onnellinen aika.", "gender": null },
    { "es": "cependant", "fi": "kuitenkin", "example_es": "Cependant, tout a changé.", "example_fi": "Kuitenkin kaikki muuttui.", "gender": null },
    { "es": "donc", "fi": "siis, joten", "example_es": "J'étais heureux, donc je souriais.", "example_fi": "Olin onnellinen, joten hymyilin.", "gender": null },
    { "es": "parce que", "fi": "koska", "example_es": "J'aimais l'été parce qu'on jouait dehors.", "example_fi": "Pidin kesästä koska leikimme ulkona.", "gender": null },
    { "es": "regretter", "fi": "katua, ikävöidä", "example_es": "Je regrette ces années-là.", "example_fi": "Ikävöin noita vuosia.", "gender": null },
    { "es": "se rappeler", "fi": "muistaa", "example_es": "Je me rappelle bien cette période.", "example_fi": "Muistan hyvin sen ajan.", "gender": null },
    { "es": "malheureusement", "fi": "valitettavasti", "example_es": "Malheureusement, ça ne dure pas.", "example_fi": "Valitettavasti se ei kestä.", "gender": null },
    { "es": "heureusement", "fi": "onneksi", "example_es": "Heureusement, mes grands-parents habitaient près.", "example_fi": "Onneksi isovanhempani asuivat lähellä.", "gender": null },
    { "es": "en revanche", "fi": "toisaalta", "example_es": "En revanche, la ville était bruyante.", "example_fi": "Toisaalta kaupunki oli meluisa.", "gender": null },
    { "es": "de plus", "fi": "lisäksi", "example_es": "De plus, nous avions un grand jardin.", "example_fi": "Lisäksi meillä oli iso puutarha.", "gender": null },
    { "es": "par conséquent", "fi": "tämän johdosta, siitä syystä", "example_es": "Par conséquent, j'ai beaucoup de bons souvenirs.", "example_fi": "Tämän johdosta minulla on paljon hyviä muistoja.", "gender": null }
  ],
  "side_panel": {
    "tabs": [
      {
        "id": "vocab",
        "title": "Sanasto",
        "content_md": "## Avainfraasit kirjoitelmaan\n\n- **Quand j'étais petit(e), ...**, imparfait!\n- **Il y avait ...**, kuvaa ympäristöä\n- **Tous les étés / chaque soir**, toistuva toiminta\n- **Un jour, ...**, yksittäinen muisto\n- **Je me souviens de ...**, reflektio\n- **C'était une époque heureuse.**, yhteenveto\n\n## Sidesanat\n\n- **et**, ja\n- **mais**, mutta\n- **donc**, siis, joten\n- **alors**, niin, sitten\n- **parce que**, koska\n- **cependant**, kuitenkin\n- **de plus**, lisäksi\n- **en revanche**, toisaalta\n- **malheureusement**, valitettavasti\n- **heureusement**, onneksi\n\n## Reflektioilmaukset\n\n- **Je regrette ces années.**, Ikävöin niitä vuosia.\n- **Je me souviens encore.**, Muistan vieläkin.\n- **C'était une belle époque.**, Se oli kaunis aika.\n- **Ces souvenirs sont précieux.**, Nämä muistot ovat kallisarvoisia."
      },
      {
        "id": "tips",
        "title": "YO-vinkki",
        "content_md": "## Kirjoitelma YO-kokeessa\n\n**Merkkimäärä** (ilman välilyöntejä ja rivinvaihtoja):\n- Lyhyt: 160–240 merkkiä\n- Pitkä: 300–450 merkkiä\n\nYlitys: lyhyessä -3 p, pitkässä -6 p.\n\n## Pisteiden nosto, konkreettiset vinkit\n\n**Kielen rakenteet (2→3):**\n- Imparfait + passé composé molemmat oikein\n- être/avoir-jako oikein\n\n**Sanasto (2→3):**\n- Älä käytä vain bon/mauvais/faire\n- Korvaa 'beau' → magnifique, superbe, joli\n\n**Kokonaisuus (2→3):**\n- Vähintään 3–4 sidesanaa\n- Selkeä rakenne: alku, tapahtuma, lopetus\n\n**Viestinnällisyys (3→4):**\n- Käsittele kaikki tehtävän kohdat\n- Rekisteri: jos kirje, aloita 'Bonjour' tai 'Cher/Chère'\n\n## YO-klassikko lapsuuskirjoitelma\n\nYTL kysyy lapsuudesta lähes joka vuosi. Harjoittele tätä niin hyvin, että se tulee automaattisesti."
      }
    ]
  }
}
