{
  "meta": {
    "course_key": "kurssi_8",
    "lesson_index": 1,
    "lesson_type": "grammar",
    "level": "E",
    "title": "Subjunktiivi imperfekti — muodostus",
    "description": "PLACEHOLDER — sisältö generoidaan myöhemmin PROMPT_GENERATE_LESSON.md:llä",
    "yo_relevance": "PLACEHOLDER",
    "estimated_minutes_median": 12
  },
  "teaching": {
    "intro_md": "PLACEHOLDER — opetussisältö generoidaan myöhemmin",
    "key_points": [
      "PLACEHOLDER"
    ]
  },
  "phases": [
    {
      "phase_id": "p1-placeholder",
      "phase_type": "recognition_mc",
      "title": "PLACEHOLDER",
      "instruction": "PLACEHOLDER",
      "mastery_threshold": {
        "I": 0.5,
        "A": 0.6,
        "B": 0.65,
        "C": 0.7,
        "M": 0.75,
        "E": 0.85,
        "L": 0.9
      },
      "items": [
        {
          "item_type": "mc",
          "stem": "PLACEHOLDER",
          "choices": [
            "a",
            "b",
            "c",
            "d"
          ],
          "correct_index": 0,
          "explanation": "PLACEHOLDER"
        },
        {
          "item_type": "mc",
          "stem": "PLACEHOLDER",
          "choices": [
            "a",
            "b",
            "c",
            "d"
          ],
          "correct_index": 0,
          "explanation": "PLACEHOLDER"
        },
        {
          "item_type": "mc",
          "stem": "PLACEHOLDER",
          "choices": [
            "a",
            "b",
            "c",
            "d"
          ],
          "correct_index": 0,
          "explanation": "PLACEHOLDER"
        },
        {
          "item_type": "mc",
          "stem": "PLACEHOLDER",
          "choices": [
            "a",
            "b",
            "c",
            "d"
          ],
          "correct_index": 0,
          "explanation": "PLACEHOLDER"
        }
      ]
    }
  ],
  "vocab": [
    {
      "es": "PLACEHOLDER",
      "fi": "PLACEHOLDER"
    }
  ],
  "side_panel": {
    "tabs": [
      {
        "id": "vocab",
        "title": "Sanasto",
        "content_md": "PLACEHOLDER"
      }
    ]
  }
}