{
  "meta": {
    "course_key": "kurssi_2",
    "lesson_index": 9,
    "lesson_type": "writing",
    "level": "A",
    "title": "Kirjoittaminen: Décrivez votre journée typique",
    "description": "Kirjoitat ranskaksi oman tavallisen päiväsi kuvauksen. Harjoittelet YO-kirjoitelman rakennetta, sanastoa ja kielen rakenteita.",
    "yo_relevance": "YO-kirjoitelma arvioidaan neljällä dimensiolla: viestinnällisyys, rakenteet, sanasto ja kokonaisuus. Tämä tehtävä harjoittelee kaikkia neljää. Lyhyt kirjoitelma = 160–240 merkkiä, pitkä = 300–450 merkkiä (ilman välilyöntejä).",
    "estimated_minutes_median": 20
  },
  "teaching": {
    "intro_md": "# Kirjoittaminen ranskaksi\n\nYO-kirjoitelman rakenne ja arviointi (4 dimensiota):\n\n## 1. Viestinnällisyys (V)\n- Käsitteletkö kaikkia tehtävän kohtia?\n- Välittyykö viesti selkeästi?\n- Onko rekisteri oikea (tu/vous)?\n\n## 2. Kielen rakenteet (R)\n- Présent oikein (être/avoir/faire/aller/prendre)\n- Partitiivit (du/de la/de l'/des)\n- Kieltomuoto (ne...pas de)\n- Accord (adjektiivin sukupuoli ja luku)\n\n## 3. Sanasto (S)\n- Arjen verbit ja substantiivit\n- Aiheeseen sopivat sanat\n- Vaihtelevuus (ei toistoa)\n\n## 4. Kokonaisuus (K)\n- Sidesanat: et, mais, parce que, alors, ensuite\n- Kappalejako pitkässä tehtävässä\n- Aloitus ja lopetus\n\n## Hyödyllisiä sidesanoja\n\n- **et**, ja\n- **mais**, mutta\n- **parce que / car**, koska\n- **ensuite**, sitten\n- **puis**, sitten, sen jälkeen\n- **d'abord**, ensin\n- **après**, jälkeen\n- **enfin**, lopuksi\n- **donc**, joten, siis\n\n## Aikaviittaukset\n\n- *le matin / à midi / le soir*\n- *d'abord... ensuite... enfin...*\n- *tous les jours / chaque jour*\n- *le week-end / le samedi*",
    "key_points": [
      "Kirjoita vähintään 160 merkkiä lyhyessä tehtävässä (ilman välilyöntejä).",
      "Käytä sidesanoja: et, mais, parce que, ensuite, ne nostavat K-pisteitä.",
      "Vaihtele verbejä: être, avoir, aller, faire, prendre, jouer, ei toistoa.",
      "Tarkista accord: une journée typique, une petite chambre.",
      "Muista kieltomuoto: je ne mange pas de viande (ei du viande kiellossa)."
    ]
  },
  "phases": [
    {
      "phase_id": "p1-writing-long",
      "phase_type": "writing_long",
      "title": "Kirjoitelma: Ma journée typique",
      "instruction": "Kirjoita ranskaksi.",
      "mastery_threshold": { "I": 0.30, "A": 0.38, "B": 0.52, "C": 0.63, "M": 0.75, "E": 0.85, "L": 0.95 },
      "skip_for_targets": [],
      "items": [
        {
          "item_type": "writing",
          "prompt": "Décrivez votre journée typique en français. Mentionnez : (1) vos repas (petit-déjeuner, déjeuner, dîner), (2) vos activités après l'école, (3) vos loisirs le week-end. Utilisez les structures étudiées dans le cours 2 : les verbes irréguliers, les partitifs (du/de la/des) et les accords. Longueur recommandée : 160–240 caractères (rédaction courte) ou 300–450 caractères (rédaction longue).",
          "min_words": 40,
          "max_words": 120,
          "rubric_focus": ["communication", "structure", "vocab", "overall"]
        },
        {
          "item_type": "writing",
          "prompt": "Vous écrivez un message à votre correspondant(e) français(e). Décrivez une journée de votre vie en Finlande : l'école, les repas, les activités. Comparez avec ce que vous savez de la France. Rédaction courte : 160–240 caractères (sans espaces).",
          "min_words": 35,
          "max_words": 90,
          "rubric_focus": ["communication", "vocab", "structure"]
        },
        {
          "item_type": "writing",
          "prompt": "Décrivez le week-end idéal : où allez-vous, avec qui, qu'est-ce que vous mangez et buvez, quels sont vos loisirs ? Longueur recommandée : 160–240 caractères (rédaction courte).",
          "min_words": 35,
          "max_words": 90,
          "rubric_focus": ["communication", "structure", "vocab"]
        }
      ]
    }
  ],
  "vocab": [
    { "es": "d'abord", "fi": "ensin, aluksi", "example_es": "D'abord, je me réveille à 7h.", "example_fi": "Ensin herään kello 7.", "gender": null },
    { "es": "ensuite", "fi": "sitten, sen jälkeen", "example_es": "Ensuite, je prends mon petit-déjeuner.", "example_fi": "Sen jälkeen syön aamiaiseni.", "gender": null },
    { "es": "puis", "fi": "sitten", "example_es": "Puis je vais à l'école.", "example_fi": "Sitten menen kouluun.", "gender": null },
    { "es": "après", "fi": "jälkeen, sen jälkeen", "example_es": "Après l'école, je rentre chez moi.", "example_fi": "Koulun jälkeen palaan kotiin.", "gender": null },
    { "es": "enfin", "fi": "lopuksi, viimein", "example_es": "Enfin, je vais me coucher.", "example_fi": "Lopuksi menen nukkumaan.", "gender": null },
    { "es": "donc", "fi": "joten, siis", "example_es": "Je suis fatigué, donc je vais dormir.", "example_fi": "Olen väsynyt, joten menen nukkumaan.", "gender": null },
    { "es": "parce que", "fi": "koska", "example_es": "Je mange du poisson parce que c'est bon pour la santé.", "example_fi": "Syön kalaa koska se on terveellistä.", "gender": null },
    { "es": "mais", "fi": "mutta", "example_es": "J'aime le sport, mais je n'aime pas la natation.", "example_fi": "Pidän urheilusta, mutta en pidä uinnista.", "gender": null },
    { "es": "se coucher", "fi": "mennä nukkumaan", "example_es": "Je me couche à 22 heures.", "example_fi": "Menen nukkumaan kello 22.", "gender": null },
    { "es": "se réveiller", "fi": "herätä", "example_es": "Je me réveille à 7h.", "example_fi": "Herään kello 7.", "gender": null },
    { "es": "se lever", "fi": "nousta ylös", "example_es": "Je me lève tout de suite.", "example_fi": "Nousen heti ylös.", "gender": null },
    { "es": "rentrer", "fi": "palata kotiin", "example_es": "Je rentre à la maison à 17h.", "example_fi": "Palaan kotiin kello 17.", "gender": null },
    { "es": "se détendre", "fi": "rentoutua", "example_es": "Le soir je me détends devant la télé.", "example_fi": "Illalla rentoudun television ääressä.", "gender": null },
    { "es": "passer du temps", "fi": "viettää aikaa", "example_es": "Je passe du temps avec mes amis.", "example_fi": "Vietän aikaa ystävieni kanssa.", "gender": null },
    { "es": "correspondant / correspondante", "fi": "kirjeenvaihtaja, kielikumppani", "example_es": "Mon correspondant est français.", "example_fi": "Kirjeenvaihtajani on ranskalainen.", "gender": null },
    { "es": "comparer", "fi": "vertailla", "example_es": "Je compare la vie en France et en Finlande.", "example_fi": "Vertailen elämää Ranskassa ja Suomessa.", "gender": null }
  ],
  "side_panel": {
    "tabs": [
      {
        "id": "vocab",
        "title": "Kirjoitelman sanasto",
        "content_md": "## Aikaviittaukset\n\n- **le matin**, aamulla\n- **à midi**, puolipäivällä\n- **le soir**, illalla\n- **le week-end**, viikonloppuna\n- **tous les jours**, joka päivä\n- **d'habitude**, tavallisesti\n\n## Järjestyssanat\n\n- **d'abord**, ensin\n- **ensuite / puis**, sitten\n- **après**, jälkeen\n- **enfin**, lopuksi\n\n## Sidesanat\n\n- **et**, ja\n- **mais**, mutta\n- **parce que / car**, koska\n- **donc**, joten\n- **alors**, sitten, joten\n\n## Verbit (arki)\n\n- **se réveiller**, herätä\n- **se lever**, nousta\n- **rentrer**, palata kotiin\n- **se coucher**, mennä nukkumaan\n- **se détendre**, rentoutua\n- **passer du temps**, viettää aikaa"
      },
      {
        "id": "grammar",
        "title": "Muistilista kirjoitelmaan",
        "content_md": "## Tarkistuslista ennen palautusta\n\n### Verbit\n- [ ] être: je suis, il est, nous sommes\n- [ ] avoir: j'ai, il a, nous avons\n- [ ] faire: je fais, il fait, nous faisons\n- [ ] aller: je vais, il va, nous allons\n\n### Partitiivit\n- [ ] myönteinen: **du** pain, **de la** viande, **de l'**eau, **des** légumes\n- [ ] kielteinen: ne...pas **de** (pas du → pas **de**)\n- [ ] beaucoup: beaucoup **de** pain (ei du)\n\n### Accord\n- [ ] maskuliini: un livre intéressant\n- [ ] feminiini: une histoire intéressante\n- [ ] monikko: des livres intéressants\n\n### Omistuspronominit\n- [ ] vokaali: **mon** amie (ei ma amie)\n- [ ] son/sa per seuraava sana, ei omistaja"
      },
      {
        "id": "tips",
        "title": "YO-vinkki",
        "content_md": "## YO-kirjoitelma, pisteet\n\n**Lyhyt kirjoitelma (rédaction courte):** 160–240 merkkiä (ilman välilyöntejä) = 33 p\n**Pitkä kirjoitelma (rédaction longue):** 300–450 merkkiä = 66 p\n\nYlitys: lyhyt -3 p, pitkä -6 p, pysy rajoissa!\n\n## 4 dimensiota (0–5 per dimensio, max 20/20)\n\n1. **V** (Viestinnällisyys): kaikki kohdat käsitelty, viesti selvä\n2. **R** (Rakenteet): présent oikein, accord, partitiivit\n3. **S** (Sanasto): vaihteleva, aiheeseen sopiva\n4. **K** (Kokonaisuus): sidesanat, kappalejako, rakenne\n\n## Nostetaan pisteitä\n\n- Käytä vähintään 3 eri sidesanaa\n- Vaihtele verbejä, ei vain être + avoir\n- Kirjoita selkeä rakenne: alku, keskiosa, lopetus\n- Tarkista accord jokaisen adjektiivin kohdalla"
      }
    ]
  }
}
