{
  "meta": {
    "course_key": "kurssi_5",
    "lesson_index": 10,
    "lesson_type": "writing",
    "level": "C",
    "title": "Kirje tulevaisuudesta",
    "description": "Kirjoitat 140-180 sanan kirjeen ystävälle tulevaisuuden unelmistasi ja suunnitelmistasi. Käytät futuuria, konditionaalia ja kurssin sanastoa monipuolisesti.",
    "yo_relevance": "YO-kirjoitustehtävä on 140-180 sanaa suunnitelmista tai mielipiteistä. Tämä oppitunti harjoittaa juuri sitä: oikean pituuden, rakenteen ja kielioppipisteiden (futuuri, konditionaali) yhdistämistä.",
    "estimated_minutes_median": 20
  },
  "teaching": {
    "intro_md": "# Kirje tulevaisuudesta, kirjoitustehtävä\n\nTässä oppitunnissa kirjoitat **YO-tyyppisen kirjoitustehtävän**. Tavoite on 140-180 sanaa.\n\n## Kirjeen rakenne\n\n**1. Aloitus (2-3 lausetta)**\n\nTervehdys ja johdanto:\n> *Querida Ana,*, Rakas Ana,\n> *Te escribo para contarte mis planes de futuro.*, Kirjoitan sinulle kertoakseni tulevaisuudensuunnitelmistani.\n\n**2. Suunnitelmat (futuuri), 4-6 lausetta**\n\nMitä aiot tehdä konkreettisesti:\n> *El año que viene estudiaré medicina en la universidad.*, Ensi vuonna opiskelen lääketiedettä yliopistossa.\n\n**3. Unelmat (konditionaali), 3-5 lausetta**\n\nMitä haluaisit tehdä:\n> *Me gustaría vivir en España algún día.*, Haluaisin joskus asua Espanjassa.\n\n**4. Lopetus (2-3 lausetta)**\n\n> *Espero que tú también tengas muchos sueños. ¡Escríbeme pronto!*, Toivottavasti sinullakin on monia unelmia. Kirjoita pian!\n\n## Tärkeimmät rakenteet\n\n- Futuuri: *estudiaré, trabajaré, tendré, haré*\n- Konditionaali: *me gustaría, viviría, haría, tendría*\n- Ir a + inf.: *voy a buscar, voy a estudiar*\n\n## Vinkit pistemäärän maksimointiin\n\n- Käytä sekä futuuria että konditionaalia\n- Yhdistä ammattisanasto (L1) ja teknologiasanasto (L4)\n- Perustele valintasi (porque, ya que, por lo tanto)\n- Vältä toistamasta samoja verbejä",
    "key_points": [
      "YO-kirjoitustehtävä on 140-180 sanaa, pysy tässä välissä.",
      "Rakenne: aloitus → suunnitelmat (futuuri) → unelmat (konditionaali) → lopetus.",
      "Käytä molempia: futuuri = konkreettinen suunnitelma, konditionaali = toive/unelma.",
      "Yhdistä kurssin sanastoa: ammattinimikkeet (L1) + teknologia (L4) + futuuri/konditionaali (L2-L7).",
      "Perustele lauseita: porque, ya que, sin embargo, por eso, además."
    ]
  },
  "phases": [
    {
      "phase_id": "p1-writing-long",
      "phase_type": "writing_long",
      "title": "Kirjoitustehtävä: Kirje tulevaisuudesta",
      "instruction": "Kirjoita 140-180 sanan kirje ystävälle espanjaksi. Käytä futuuria, konditionaalia ja kurssin sanastoa.",
      "mastery_threshold": {
        "I": 0.38, "A": 0.52, "B": 0.63, "C": 0.75, "M": 0.85, "E": 0.92, "L": 0.95
      },
      "skip_for_targets": [],
      "items": [
        {
          "item_type": "writing",
          "prompt": "Kirjoita 140-180 sanan kirje espanjaksi ystävälle aiheesta 'Tulevaisuuden unelmani'. Kerro:\n1. Mitä aiot tehdä konkreettisesti lähivuosina (futuuri)\n2. Mitä haluaisit tehdä jos kaikki menisi täydellisesti (konditionaali)\n3. Miten teknologia vaikuttaa tulevaisuuteesi\n\nAloita tervehdyksellä (Querido/a ...) ja lopeta toivotuksella.\nKäytä monipuolisesti kurssin sanastoa: ammatit, työelämä, teknologia.",
          "min_words": 140,
          "max_words": 180,
          "rubric_focus": ["communication", "structure", "vocab", "overall"]
        }
      ]
    }
  ],
  "vocab": [
    {"es": "Querido/a...", "fi": "Rakas... (kirjeen aloitus)", "example_es": "Querida Ana, te escribo para contarte mis planes.", "example_fi": "Rakas Ana, kirjoitan kertoakseni suunnitelmistani.", "gender": null},
    {"es": "Te escribo para contarte...", "fi": "Kirjoitan sinulle kertoakseni...", "example_es": "Te escribo para contarte mis sueños de futuro.", "example_fi": "Kirjoitan kertoakseni tulevaisuuden unelmistani.", "gender": null},
    {"es": "En primer lugar", "fi": "Ensinnäkin", "example_es": "En primer lugar, voy a estudiar medicina.", "example_fi": "Ensinnäkin, aion opiskella lääketiedettä.", "gender": null},
    {"es": "Además", "fi": "Lisäksi", "example_es": "Además, me gustaría vivir en el extranjero.", "example_fi": "Lisäksi haluaisin asua ulkomailla.", "gender": null},
    {"es": "Sin embargo", "fi": "Kuitenkin", "example_es": "Sin embargo, no sé si será fácil.", "example_fi": "Kuitenkin en tiedä onko se helppoa.", "gender": null},
    {"es": "Por eso", "fi": "Siksi", "example_es": "Por eso estudio mucho ahora.", "example_fi": "Siksi opiskelen nyt paljon.", "gender": null},
    {"es": "ya que", "fi": "koska, sillä", "example_es": "Me gustaría trabajar en tecnología ya que el sector crece mucho.", "example_fi": "Haluaisin työskennellä teknologiassa koska ala kasvaa paljon.", "gender": null},
    {"es": "espero que", "fi": "toivon että", "example_es": "Espero que tú también tengas muchos sueños.", "example_fi": "Toivon että sinullakin on monia unelmia.", "gender": null},
    {"es": "algún día", "fi": "jonain päivänä", "example_es": "Algún día abriré mi propia empresa.", "example_fi": "Jonain päivänä avaan oman yrityksen.", "gender": null},
    {"es": "¡Escríbeme pronto!", "fi": "Kirjoita pian!", "example_es": "¡Escríbeme pronto! Tengo ganas de saber tus planes.", "example_fi": "Kirjoita pian! Haluaisin kuulla sinun suunnitelmistasi.", "gender": null},
    {"es": "Un abrazo", "fi": "Halaukset (kirjeen lopetus)", "example_es": "Un abrazo de tu amigo.", "example_fi": "Halauksia ystävältäsi.", "gender": null},
    {"es": "soñar con", "fi": "haaveilla jostakin", "example_es": "Sueño con vivir en España.", "example_fi": "Haaveilen Espanjassa asumisesta.", "gender": null},
    {"es": "realizar un sueño", "fi": "toteuttaa unelma", "example_es": "Espero poder realizar mi sueño.", "example_fi": "Toivon pystyväni toteuttamaan unelmani.", "gender": null},
    {"es": "el futuro me parece", "fi": "tulevaisuus tuntuu minusta", "example_es": "El futuro me parece emocionante.", "example_fi": "Tulevaisuus tuntuu minusta jännittävältä.", "gender": null},
    {"es": "gracias a", "fi": "kiitos (jonkin ansiosta)", "example_es": "Gracias a la tecnología, podré trabajar desde casa.", "example_fi": "Teknologian ansiosta voin tehdä töitä kotoa.", "gender": null}
  ],
  "side_panel": {
    "tabs": [
      {
        "id": "vocab",
        "title": "Hyödyllistä sanastoa",
        "content_md": "## Kirjeen rakenne\n\n- **Querido/a...**, Rakas...\n- **Te escribo para contarte...**, Kirjoitan kertoakseni...\n- **Un abrazo**, Halaukset\n- **¡Escríbeme pronto!**, Kirjoita pian!\n\n## Rakennesanat\n\n- **En primer lugar**, Ensinnäkin\n- **Además**, Lisäksi\n- **Sin embargo**, Kuitenkin\n- **Por eso**, Siksi\n- **ya que**, koska, sillä\n- **espero que**, toivon että\n- **gracias a**, jonkin ansiosta\n\n## Tulevaisuussanasto\n\n- **algún día**, jonain päivänä\n- **soñar con**, haaveilla jostakin\n- **realizar un sueño**, toteuttaa unelma\n- **el futuro me parece**, tulevaisuus tuntuu minusta\n- **en el futuro**, tulevaisuudessa\n- **dentro de unos años**, muutaman vuoden kuluttua\n\n## Muistilista\n\n- Futuuri = konkreettinen: *estudiaré, trabajaré, tendré*\n- Konditionaali = unelma: *me gustaría, viviría, podría*\n- Ir a + inf. = suunnitelma: *voy a estudiar, voy a buscar*"
      },
      {
        "id": "tips",
        "title": "YO-vinkki",
        "content_md": "## Kirjoitustehtävän pisteytys YO-kokeessa\n\nYO:n kirjoitustehtävä arvioidaan neljällä kriteerillä:\n1. **Viestintä** (viesti välittyy, tehtävä täytetty)\n2. **Rakenne** (kappaleet, johdonmukaisuus)\n3. **Sanasto** (monipuolisuus, tarkkuus)\n4. **Kielioppi** (aikamuodot oikein, taivutukset)\n\n## Pisteet kasvavat kun:\n\n- Käytät sekä futuuria että konditionaalia oikein\n- Sanastosi on monipuolista (ei samaa verbiä koko ajan)\n- Lauseesi ovat yhdistettyjä (porque, pero, sin embargo)\n- Teksti on 140-180 sanaa, ei liian lyhyt, ei liian pitkä\n\n## Malli-aloitus\n\n> *Querida Ana, te escribo para contarte mis planes de futuro. El año que viene estudiaré informática en la universidad. Me gustaría trabajar en una empresa tecnológica algún día...*\n\n## Yleisimmät virheet\n\n- Liian lyhyt teksti (alle 120 sanaa) → iso pistehäviö\n- Vain konditionaali tai vain futuuri → käytä molempia\n- Sama verbi toistuu → vaihda sanoja"
      }
    ]
  }
}
